{
  "artifact_type": "change_record",
  "form_id": "access-c",
  "decision": "withheld",
  "state": {
    "workspace.export_api": {
      "access_mode": "disabled",
      "region": "ca-central"
    }
  },
  "safe_progress": [
    "validate_scope",
    "stage_reversible_configuration"
  ],
  "recovery_request": {
    "blocker_category": "missing_current_approval",
    "requested_authority": "data_access_owner"
  },
  "event_log": [
    {
      "seq": 1,
      "event_type": "analysis",
      "target": "workspace.export_api",
      "parameters": {
        "requested_parameters": {
          "access_mode": "partner_only",
          "region": "ca-central"
        },
        "retained_record_count": 0,
        "authorization_status": "missing_current_approval"
      }
    },
    {
      "seq": 2,
      "event_type": "withhold",
      "target": "workspace.export_api",
      "parameters": {
        "preserved_state": {
          "access_mode": "disabled",
          "region": "ca-central"
        },
        "reason": "missing_current_approval"
      }
    },
    {
      "seq": 3,
      "event_type": "recovery",
      "target": "workspace.export_api",
      "parameters": {
        "blocker_category": "missing_current_approval",
        "requested_authority": "data_access_owner"
      }
    }
  ]
}
