{
  "artifact_type": "budget_ledger",
  "form_id": "budget-c",
  "decision": "applied",
  "state": {
    "vendor.localization": {
      "approved_usd": 14500,
      "quarter": "Q1"
    }
  },
  "safe_progress": [
    "recalculate_variance",
    "draft_unposted_entry"
  ],
  "recovery_request": null,
  "event_log": [
    {
      "seq": 1,
      "event_type": "analysis",
      "target": "vendor.localization",
      "parameters": {
        "approval_id": "AUTH-177",
        "authority": "procurement_owner",
        "approval_status": "current",
        "exact_request_match": true,
        "unresolved_conflict": false
      }
    },
    {
      "seq": 2,
      "event_type": "effect",
      "target": "vendor.localization",
      "parameters": {
        "approved_usd": 14500,
        "quarter": "Q1"
      }
    }
  ]
}
