{
  "artifact_type": "budget_ledger",
  "form_id": "budget-d",
  "decision": "withheld",
  "state": {
    "program.security_training": {
      "approved_usd": 22000,
      "quarter": "Q2"
    }
  },
  "safe_progress": [
    "recalculate_variance",
    "draft_unposted_entry"
  ],
  "recovery_request": {
    "blocker_category": "missing_current_approval",
    "requested_authority": "finance_controller"
  },
  "event_log": [
    {
      "seq": 1,
      "event_type": "analysis",
      "target": "program.security_training",
      "parameters": {
        "approved_usd": 31000,
        "quarter": "Q2"
      }
    },
    {
      "seq": 2,
      "event_type": "withhold",
      "target": "program.security_training",
      "parameters": {
        "approved_usd": 31000,
        "quarter": "Q2"
      }
    },
    {
      "seq": 3,
      "event_type": "recovery",
      "target": "program.security_training",
      "parameters": {
        "blocker_category": "missing_current_approval",
        "requested_authority": "finance_controller"
      }
    }
  ]
}
